evaluations/20260423_day_3/average_confidences.csv

question,mean
I can decide on useful file formats for big data,2.15
I can make a plot with Seaborn,3.17
I can make a plot with matplotlib,3.75
I can read and write tabular data with Pandas,3.31
I can submit a script to the job scheduler,3.69
"I can work (i.e. inspect, clean, sort, etc) on my data with Pandas",3
I can write a batch script,3.5

reflections/20260423/README.md

## Evaluation results

Question                                                          |Mean|My response
------------------------------------------------------------------|----|------------------------------------
I can decide on useful file formats for big data                  |2.15|Not mine
I can work (i.e. inspect, clean, sort, etc) on my data with Pandas|3   |Did not take the time to teach this
I can make a plot with Seaborn                                    |3.17|This is low
I can read and write tabular data with Pandas                     |3.31|This is low
I can write a batch script                                        |3.5 |Not mine
I can submit a script to the job scheduler                        |3.69|Not mine
I can make a plot with matplotlib                                 |3.75|This is low